Id,Code,Name,Description453,IP4-3-2,Remote sensing lifecycle,The remote sensing lifecycle structures all possible phases of the data production process - from its beginning of the data's coming to existence (that includes the sensor design prior to data collection) over storage - processing and use to archiving and deletion.454,IP4-3-3,Capability to resolve anything,The capability of a sensor or EO product to resolve anything is a function of its (spatial - temporal - spectral and radiometric) resolution and of the detail at which a geographic phenomenon of interest manifests itself in time and space. A geographic phenomenon can be named or described - georeferenced and provided with a time interval at which it exists. The geographic phenomenon of interest is the one of which a user needs information to help him make a decision. Therefore - the geographic phenomenon needs to be resolved with a low enough uncertainty and a high enough quality that allows the user to make a decision with confidence. \rFor example - let’s consider a helicopter pilot that wants to know whether a specific site is suitable for an emergency landing. The decision to perform an emergency landing may be supported with an EO-derived digital map of emergency landing sites that are flat enough (as well as large enough for the pilot’s helicopter and free of any obstacles on the surface and in the approach area). If we only focus on the flatness of the terrain - we need a digital elevation model (DEM) of high enough spatial resolution and accuracy in the Z dimension to calculate slope within acceptable levels of uncertainty. The pilot probably can tell us what degrees of slope are okay for his helicopter and tell us sites (e.g. football fields) where such a landing would succeed. However - this is only the input to an analysis of different DEMs to identify the minimum spatial resolution and accuracy in the Z dimension to model slope products and associated uncertainty to derive an emergency landing site product that fulfils the requirements. Thereby the capability of different DEMs to resolve emergency landing sites can be analysed.\rSpatial resolution is a measure of the smallest angular or linear separation between two objects that can be resolved by the remote sensing system. A useful heuristic rule of thumb is that in order to detect a feature - the nominal spatial resolution of the sensor should be less than one-half the size of the feature measured in its smallest dimension.\rOther types of resolution of an EO dataset are available that determine for various geographic phenomena under investigation whether it is possible to resolve them in the data. These are radiometric resolution - spectral resolution and temporal resolution. Radiometric resolution is defined as the sensitivity of a remote sensing detector to differences in signal strength as it records the radiant flux reflected - emitted - or back-scattered from the terrain. Spectral resolution is the number and dimension (size) of specific wavelength intervals (referred to as bands or channels) in the electromagnetic spectrum to which a remote sensing instrument is sensitive. The temporal resolution of a remote sensing system generally refers to how often the sensor records imagery of a particular area. For time-series analysis - the temporal resolution determines the time granularity for resolving processes that underlie the change that is observable between subsequent images.458,IP4,Image data quality,Data quality - in general - is the degree of data usability in relation to a specific application purpose. Assurance of data quality is of growing importance in remote sensing - due to the increasing relevance of remote sensing data in planning and operational decision of public bodies and private firms - and the huge amount of digital services (or apps) that exploit RS data. \rDifferent data quality dimensions exist according to the lifecycle phases of the remote sensing data: data acquisition - data storage - data pre-processing - processing and analysis and data visualization and delivery. Remote sensing data acquisition phase involves the following quality aspects: resolution - accessibility - spatial accuracy - temporal validity - accuracy and precision of the sensor calibration. Resolution is a multi-dimensional concept that includes the following dimensions: spatial resolution - temporal resolution - radiometric resolution - spectral resolution and temporal resolution. Temporal validity refers to the quality of an remote sensing data product in time - whereas spatial accuracy refers to the accuracy of the position of features relative the Earth.  \rData storage includes the accessibility and completeness data quality dimensions.  Accessibility includes both temporal and data accessibility. Temporal accessibility refers to the time delay between data acquisition and data delivery - whereas data accessibility refers to the availability of remote sensing data. Data completeness encompasses temporal completeness - i.e. completeness of a time series represented a phenomenon - thematic completeness - and spatial completeness which refers to the area coverage. Data preprocessing - processing and analysis phase includes consistency - completeness - temporal validity - resolution - radiometric and geometric accuracy - thematic and semantic accuracy. Thematic and sematic accuracy refers to the correctness of the remote sensing data product. The main quality dimensions of the data visualization and delivery include readability - completeness and temporal validity. \rDifferent metrics can be used to assess the quality of the remote sensing-derived information - such as the root-mean-square error (RMSE) measuring the differences between the true and measured values of the phenomenon under investigation - confusion matrix used for assessing the classification performance - producer’s accuracy - user’s accuracy or Cohen kappa. The quality of the remote sensing data per se can be assessed using Peak Signal-to-noise Ratio (PSNR) or the Universal Image Quality Index (UIQI).\rDifferent organizations are involved in the standardization of the image data and gridded data quality - including ISO/TC 211 ‘Geographic information/Geomatics’ - Open Geospatial Consortium (OGC) or the Quality Assurance Framework for Earth Observation (QA4EO) developed by the Group on Earth Observation (GEO). These organizations are responsible for developing metadata standards that are further used by the remote sensing community to document the quality of the remote sensing data. According to the QA4EO - for example - all remote sensing data products need to be accompanied by a Quality Indicator (QI) which helps users assessing their fitness-for-use.464,IP5-2,Image archives,Image archives are repositories for storing - managing and retrieving remote sensing data.468,IP5,Infrastructure,In general - infrastructures such as cyberinfrastructures or Spatial Data Infrastructures (SDIs) - allow information sharing across distributed infrastructures and communities. SDIs  have gradually changed from a pool of authoritative data shared using standardized web services to a pool where the authoritative data co-exist with data collected by volunteers and different sensors. Many efforts were dedicated to data documentation - to improving the catalogues searching techniques by means of - for example - thesauri and to sharing these data using standardized web services such as Web Map Service - Web Feature Service or Web Coverage Service. Cloud computing technologies played an important role in the implementation of sustainable SDIs due to their ability to provide on-demand computational and storage capacities over the Internet. In this way - users can easily search - find and use data shared across different online platforms.\rMore specifically - infrastructures for image processing and analysis refer to the physical and organizational facilities that allow the storage - analysis and management of the available data and products. Traditionally - this infrastructure formed a digital image processing system consisting of computer hardware with special-purpose image processing software - and peripheral input-output devices (e.g. CD or DVD drives - internet access - printers/plotters). In recent years - Earth observation is undergoing a shift to online processing making use of data cubes and vast image archives - e.g. NSF EarthCube or Digital Earth Australia - the Swiss Data Cube - the EarthServer - the E-sensing platform or the Google Earth Engine. Available infrastructures aim at sharing remote sensing data and derived products following the FAIR metrics: Findable (F) - Accessible (A) - Interoperable (I) - Reusable (R). Thus - remote sensing data have to be documented using metadata that support FAIR data principles as follows: (1) Findable: remote sensing data are findable through data documentation - i.e. metadata - that needs to include a unique identifier of the described data. Metadata can be stored in a catalog compliant to one of the available data cataloging standards such as the  SpatioTemporal Asset Catalog (STAC) compliant catalog; (2) Accessible: all data have to be openly accessible and shared using interoperable formats that allow users to find - access and reuse them; (3) Interoperable: different standards - e.g. STAC specification - have to be used to document remote sensing data; (4) Reusable: metadata have to be comprehensive enough to allow users not only to assess the fitness for purpose (e.g. lineage) but also to provide them information about how to access the generated data.503,OI5-4,Pan-European and global associations and professional organizations,The European GIS&T landscape consists of many pan-European organizations and associations promoting the interest of and representing certain stakeholder groups. While some of these organisations are dealing with all sectors and aspects of geographic information - others have a more thematic focus (e.g. remote sensing - topography - geosciences) or represent a particular sector (e.g. research - business). In some cases - their clearly is an overlap in the mission and objectives of different organizations - and some organizations are working in the same field of interest. Some examples of pan-European organizations and associations are AGILE - EuroSDR - EUROGI - and EuroGeographics. Also at international level several membership organizations and associations exist.504,OI5-5,The geospatial industry,The geospatial industry consists of companies working with location specific information or services. Within the geospatial sector - several areas of activities can be identified: 1) measuring - collecting and storing of data about geo-objects; 2) processing - editing - modelling - analyzing and managing that data; 3) presenting - producing and distributing the data; and 4) advising - educating - researching and communicating about processes and use of geo-information products and services. The sector consists of both small-and-medium-sized enterprises but also big companies - including surveyors - census hard-copy map providers - aerial photos providers - base map data providers - satellite and remote sensing imagery providers - software developers (GIS-related products and services providers as well as satellite image programming platform providers) and several others.514,PP1-1-6,Stefan–Boltzmann law. Kirchoff law,The total radiant intensity B(T ) of a blackbody at the absolute temperature T can be derived by integrating the Planck function over the entire wavelength domain from 0 to∞. Since blackbody radiation is isotropic - the flux density emitted by a blackbody is therefore F = π B(T ) which is proportional to the fourth power of the absolute temperature T through the Stefan-Boltzmann constant σ = 5.67 × 10−8 J m−2 sec−1 deg−4.\rKirchoff's law establishes that for a medium at the thermodynamic equilibrium - the spectral emissivity ε(λ) at a given wavelength λ - is equal to the its spectral absorbance - A(λ) at the same wavelength λ.   Hence ε(λ)=A(λ) at each fixed λ -  for a blackbody   ε(λ)=A(λ)=1 at whatever λ. Kirchoff's law is valid also in Local Thermodynamic Equilibrium (LTE) conditions as the ones  usually occurring in (small volumes of) the Earth's atmosphere even in the most turbulent conditions.\rKirchoff's law has important applications also for the study of spectral signatures of  mineral and rocks and - in general - of opaque - i.e. with spectral transmittance T(λ)=0 - bodies. In that case - the relation which relate the spectral reflectance R(λ) - absorbance A(λ) and transmittance T(λ) of a body: R(λ)+A(λ)+T(λ) =1\rreduce to R(λ)+A(λ)=1 and in LTE conditions - thanks to the Kirchoff's law: \rR(λ)+ε(λ)=1 which allows to obtain measurements of spectral emissivity indirectly through (more simple and stable) measurements of spectral reflectance:\rε(λ)=1-R(λ)\rRocks and mineral exhibit important (diagnostic/discriminating) signatures in their spectral emissivity in the thermal infrared (TIR) region. Measuring spectral emissivity in a laboratory (particularly if samples have to be characterized for their properties in natural conditions) is a quite difficult task due to the difficulty to insolate the sample from the lab environment (and instruments themselves) all emitting approximately at the same (environmental)  temperature. Kirchoff's law allows to obtain - for opaque bodies - spectral emissivities  from spectral reflectances measurements which are much easy to  realize in normal remote sensing labs.517,PP1-1,EM radiation,EM radiation is created when an electrically charge particle - such as an electron - is accelerated by a force causing it to move. The movement produces oscillating electric and magnetic fields which travel - as an harmonic EM wave - at right angles to each other. EM waves travel at 299 -792 -458 meters per second in a vacuum (the highest possible speed into the Universe - also known as the speed of light). \rThe electromagnetic field propagating through the space as EM waves is also referred as electromagnetic radiation. \rAn EM wave is characterized by a frequency (or by a wavelength) and by an amplitude (or by an energy). \rThe wavelength is the distance between two consecutive peaks of a wave. This distance is given in meters (m) or fractions thereof. Frequency is the number of waves that form in a given length of time. It is usually measured as the number of wave cycles per second - or Hertz (Hz). It is wave speed=frequency*wavelength so that - an EM wave traveling at the speed of light - can be equally identified by its wavelength or by its frequency. The amplitude (i.e. the maximum oscillation of the EM field) provide the intensity (i.e. the energy) of the EM wave.  \rThe classical theory describes the EM radiation as electromagnetic waves which represent the oscillations of electric and magnetic fields. In the quantum mechanics theory EM radiation consists of photons - quanta of the electromagnetic energy - responsible for all electromagnetic interactions.\rAs far as Earth remote sensing is concerned EM radiation represents the most important  vehicle of information.518,PP1-2-1,Atomic spectroscopy,The study of the absorbption/emission of electromagnetic radiation by atoms. Depending on the atomic number characteristic frequency or wavelength are absorbed or emitted. Since each element has a characteristic spectrum of absorbed/emitted wavelengths (spectral signature) - atomic spectroscopy allows the determination of elemental compositions even of remote objects (e.g. stars - galaxies - etc.).\rStarting from the simple Bohr’s model it is possible to predict quite exactly the frequencies of e.m. radiation selectively absorbed/emitted by all atoms. Depending on the atomic number Z - characteristic frequencies f are absorbed or emitted by atoms corresponding to the electronic transitions from different energetic (quantized) states following the Bohr’s condition: fab=(Eb- Ea)/h -  being Ei=-cost∙Z2/(ni)2 the electron energy corresponding to the state/level i (principal quantic number ni). By this way each atomic species has a characteristic spectrum of absorbed/emitted frequencies (atomic spectral signature) so that  atomic spectroscopy allows the determination of elemental compositions even of remote objects. By this way the existence of Helium was discovered in the 1968 by Jansen and Lockyer in the Sun photosphere well before its discover on the Earth - and the knowledge of the chemical composition of stars and galaxies was possible well before the end of XIX century. Atomic spectroscopy provides a simple and powerful introduction (through the explanation of the more complex interactions of e.m. radiation with molecules and solid matter) to the fundamental concepts of spectral signature (which is at the base of most of the applications of aerial remote sensing of the Earth’s surface) and atmospheric windows (important for the design of optical sensors devoted to remotely sense Earth’s surface) being moreover propaedeutic to the understanding of methods for the atmospheric vertical sounding based on the concepts spectral lines broadening and related weighting functions.530,PP1-2,Radiation - Matter interaction,E.M. Radiation can be absorbed - scattered - emitted and transmitted by the matter. The results of such interactions (i.e. the fraction of incident radiation that is absorbed - scattered or transmitted) or emission process (i.e. the fraction of actually emitted radiation in comparison with the one expected from a black-body at the same temerature) strongly depend on the radiation wavelength and on specific chemical (e.g. composing atoms and molecules as well as their arrangement within solid cristals) and physical (e.g. Temperature - Dimensions and Shape - Roughness) properties of the matter. In some case - the result of Radiation - Matter interaction is strongly affected by observational conditions. For instance - over some angular distance between the directions of incidence and the one of measurement of the radiation -  sun-glint can occur which completely mask any other results. A basic principle of the remote sensing put univocally in relation spectral absorbance - reflectance - transmittance and emissivity - curves achievable by multi-spectral EO measurements -  with matter having specific chemical/physical properties.  Theoretical models of radiation-matter interaction at the Earth's surface and through the atmosphere provide then suitable strategies for retrieving - from multi-spectral measurements of the radiation leaving the Earth - the most relevant chemical/physical properties of the matter composing its surface and atmosphere.535,PP1-3-5,Spectral Signature of Mineral and Rocks,Spectral signatures of rocks and mineral provide information on their chemical composition and crystal properties - grain size and roughness over a wide range of wavelengths from the visible to the thermal infrared.\rIn the Visible and Near-InfraRed (VNIR; 0.4÷1.0 µm) region - spectral features are dominated by electronic processes in transition metals - such as Fe - Mn - Cu - Ni - Cr - etc. Therefore - iron is the most important constituent having spectral properties in the VNIR - and the iron-rich minerals are characterized by low reflectance (high absorbance) below 0.7 µm.\rOther minerals - which represent the major part of the Earth's surface rocks - such us Si - Al and some anion groups (e.g. silicates - carbonates - oxides) hydroxides - have less spectral features in the VNIR region - but exhibit much more evidences in the Short-Wave InfraRed (SWIR; 1÷3 µm) region. In fact - spectral features of hydroxyls and carbonates mark the SWIR region.\rThe hydroxyl ion is a widespread constituent occurring in rock forming minerals such as clays - micas - chlorite etc. It shows a vibrational fundamental absorption band at about 2.74÷2.77 µm and an overtone at 1.44 µm.\rCarbonates - which are commonly in the Earth surface rocks in the form of calcite (CaC03) - magnesite (MgC03) - dolomite [(Ca-Mg) C03] and siderite (FeC03) - shows a typical absorbance feature around 2.3 µm - instead the water content can be instead evaluated by the depth of absorption at 1 -4µm and 1 -9 µm.\rThermal InfraRed (TIR; 1÷20 µm) region - from a geological point of view - is a particularly important spectral region for remote sensing aiming at compositional investigations of terrestrial materials. In fact - the fundamental vibration features of many rock-forming mineral groups (e.g. silicates - carbonates - oxides - phosphates - sulphates - nitrates - nitrites - hydroxyls) occur in the TIR region. Briefly:\ra) the silicates - which are most abundant group of minerals in the Earth's crust - shows vibrational spectral features due to the presence of Si04-tetrahedron around 8 µm to 12 µm; b) the carbonates show a weak feature around 11.3 µm that can be detected; c) the sulphates display bands near 9 µm and 16 µm; d) the phosphates also have fundamental features near 9.25 µm and 10.3 µm; e) the features in oxides usually occupy the same range as that of bands in Si-O - i.e. 8 µm to 12 µm; g) the nitrates have spectral features at 7.2 µm and the nitrites at 8 µm and 11.8 µm; h) the hydroxyl ions display fundamental vibration bands at 11 µm.538,PP1-3-8,Definition of active and passive remote sensing techniques,One of the most common ways to classify remote sensing systems consists in distinguishing them into the passive systems - which detect naturally occurring radiation - and the active systems - which emit radiation and analyse what is sent back to them. The passive systems can be further subdivided into those that detect radiation emitted by the Sun (this radiation consists mostly of ultraviolet - visible and near-infrared radiation) - and those that detect the thermal radiation that is emitted by all objects that are not at absolute zero (i.e. all objects). For objects at typical terrestrial temperatures - this thermal emission occurs mostly in the infrared part of the spectrum - at wavelengths of the order of 10 μm (the so called thermal infrared region) - although measurable quantities of radiation also occur at longer wavelengths - as far as the microwave part of the spectrum. Active systems can - in principle - use any type of electromagnetic radiation - resulting able to obtain measurements anytime - regardless of the time of day or season. In practice - however - they are restricted by the transparency of the Earth’s atmosphere at the specific spectral range considered. In any case they can be used for examining wavelengths that are not sufficiently provided by the sun - such as microwaves - or to better control the way a target is illuminated. Active sensors may be classified according to the use that is made of the returned signal. Two main methods have been identified to this aim so far: the Ranging technique mostly concerns with the time delay between transmission and reception of the signal - while the Scattering one is mostly focused on the strength of the received signal.552,PP1-5-1,Reflection - Refraction and Dispersion of the light,Light is the electromagnetic phenomenon we exploit for remote sensing. Its basic laws concerning the transmission through the interface of two different media are governed by reflection and refraction. Reflection governs the way light is backpropagated and refraction dictates how light is transmitted. Refraction is related to the real refractive index of a medium. Dispersion relates to the way the light of a given wavelength is transmitted. Since light of different wavelengths are transmitted at different angles - the phenomenon leads to the concept of dispersion. These three simple principles are at the core of the understanding technology of remote sensing.554,PP1-5-14,Electric conduction in solids: semiconductors - p-n- junction - diode and transistors,Solid state modern detectors rely on non-metal junction - which can be designed and operated to yield a bandgap energy according to the spectral range (infrared - visible - UV) to be detected. The basic principles of how these devices are designed and fabricated is important to develop and design new sensors useful for the various remote sensing applications.556,PP1-5-2,Interference and Diffraction.,Interference and diffraction are phenomena related to the wave nature of electromagnetic radiation. They explain how light propagates in presence of obstacles. These phenomena are largely used in the fabrications of optical systems for remote sensing: e.g. radiometers and spectrometers.